{
  "schemaVersion": 1,
  "contentVersion": "base-cards-v1",
  "effectSpecVersion": "effect-spec-v1",
  "abilities": [
    {
      "abilityId": "baz-001.level-1.ability",
      "cardId": "baz-001",
      "faceId": "level-1",
      "exactTextSha256": "e2f88b3f49ea6023499e7e3a58a3e16b1b07a5ef018e5500e892e79f7a639b61",
      "source": {
        "evidenceId": "base-gallery-2026-10-17",
        "fieldPath": "cards[baz-001].faces[level-1].exactAbilityText"
      },
      "effectSpec": {
        "status": "deferred",
        "trackingIssue": "#12",
        "reason": "Issue #6 records exact text; executable semantics belong to M1-P10."
      },
      "ambiguityReview": {
        "status": "none-recorded",
        "identifiedAmbiguities": [],
        "ownerDecisionRefs": []
      },
      "conformanceScenarioIds": [
        "baz-001.level-1.ability.conformance"
      ]
    },
    {
      "abilityId": "baz-002.front.ability",
      "cardId": "baz-002",
      "faceId": "front",
      "exactTextSha256": "f1b1fe847f6efb6cd3219d786da0d2cfb42a8bc3c1c904e66d7950f0df572887",
      "source": {
        "evidenceId": "base-gallery-2026-10-17",
        "fieldPath": "cards[baz-002].faces[front].exactAbilityText"
      },
      "effectSpec": {
        "status": "deferred",
        "trackingIssue": "#12",
        "reason": "Issue #6 records exact text; executable semantics belong to M1-P10."
      },
      "ambiguityReview": {
        "status": "none-recorded",
        "identifiedAmbiguities": [],
        "ownerDecisionRefs": []
      },
      "conformanceScenarioIds": [
        "baz-002.front.ability.conformance"
      ]
    },
    {
      "abilityId": "baz-003.front.ability",
      "cardId": "baz-003",
      "faceId": "front",
      "exactTextSha256": "d54ad94eee3660d66a234ec773a63c4308b2b65c62c45ed117f947f33df8a7d1",
      "source": {
        "evidenceId": "base-gallery-2026-10-17",
        "fieldPath": "cards[baz-003].faces[front].exactAbilityText"
      },
      "effectSpec": {
        "status": "deferred",
        "trackingIssue": "#12",
        "reason": "Issue #6 records exact text; executable semantics belong to M1-P10."
      },
      "ambiguityReview": {
        "status": "none-recorded",
        "identifiedAmbiguities": [],
        "ownerDecisionRefs": []
      },
      "conformanceScenarioIds": [
        "baz-003.front.ability.conformance"
      ]
    },
    {
      "abilityId": "baz-004.front.ability",
      "cardId": "baz-004",
      "faceId": "front",
      "exactTextSha256": "135e7edef550fdffe066fd36d8cf3928c044ebab93b3406c681c620bea7e6508",
      "source": {
        "evidenceId": "base-gallery-2026-10-17",
        "fieldPath": "cards[baz-004].faces[front].exactAbilityText"
      },
      "effectSpec": {
        "status": "deferred",
        "trackingIssue": "#12",
        "reason": "Issue #6 records exact text; executable semantics belong to M1-P10."
      },
      "ambiguityReview": {
        "status": "none-recorded",
        "identifiedAmbiguities": [],
        "ownerDecisionRefs": []
      },
      "conformanceScenarioIds": [
        "baz-004.front.ability.conformance"
      ]
    },
    {
      "abilityId": "baz-005.front.ability",
      "cardId": "baz-005",
      "faceId": "front",
      "exactTextSha256": "a39706d0ff9e48837fc9763c9a8eb251fee71e3a1050bc2ebe0213633d5e2176",
      "source": {
        "evidenceId": "base-gallery-2026-10-17",
        "fieldPath": "cards[baz-005].faces[front].exactAbilityText"
      },
      "effectSpec": {
        "status": "deferred",
        "trackingIssue": "#12",
        "reason": "Issue #6 records exact text; executable semantics belong to M1-P10."
      },
      "ambiguityReview": {
        "status": "none-recorded",
        "identifiedAmbiguities": [],
        "ownerDecisionRefs": []
      },
      "conformanceScenarioIds": [
        "baz-005.front.ability.conformance"
      ]
    },
    {
      "abilityId": "baz-006.front.ability",
      "cardId": "baz-006",
      "faceId": "front",
      "exactTextSha256": "55a73f732c34453ce51e3089dc7d31b0bd9cc165826ea9cf33c3bf70c2e871dd",
      "source": {
        "evidenceId": "base-gallery-2026-10-17",
        "fieldPath": "cards[baz-006].faces[front].exactAbilityText"
      },
      "effectSpec": {
        "status": "deferred",
        "trackingIssue": "#12",
        "reason": "Issue #6 records exact text; executable semantics belong to M1-P10."
      },
      "ambiguityReview": {
        "status": "none-recorded",
        "identifiedAmbiguities": [],
        "ownerDecisionRefs": []
      },
      "conformanceScenarioIds": [
        "baz-006.front.ability.conformance"
      ]
    },
    {
      "abilityId": "baz-008.front.ability",
      "cardId": "baz-008",
      "faceId": "front",
      "exactTextSha256": "8315ed3d8c3be8eb669890b74642c2fde3ba6b52251e90e07d3de96e054c5477",
      "source": {
        "evidenceId": "base-gallery-2026-10-17",
        "fieldPath": "cards[baz-008].faces[front].exactAbilityText"
      },
      "effectSpec": {
        "status": "deferred",
        "trackingIssue": "#12",
        "reason": "Issue #6 records exact text; executable semantics belong to M1-P10."
      },
      "ambiguityReview": {
        "status": "none-recorded",
        "identifiedAmbiguities": [],
        "ownerDecisionRefs": []
      },
      "conformanceScenarioIds": [
        "baz-008.front.ability.conformance"
      ]
    },
    {
      "abilityId": "baz-009.front.ability",
      "cardId": "baz-009",
      "faceId": "front",
      "exactTextSha256": "a17e7f5add8a138cc6ba98148fd5886198035e41fdcb687ea6e7eb6284cbffe5",
      "source": {
        "evidenceId": "base-gallery-2026-10-17",
        "fieldPath": "cards[baz-009].faces[front].exactAbilityText"
      },
      "effectSpec": {
        "status": "deferred",
        "trackingIssue": "#12",
        "reason": "Issue #6 records exact text; executable semantics belong to M1-P10."
      },
      "ambiguityReview": {
        "status": "none-recorded",
        "identifiedAmbiguities": [],
        "ownerDecisionRefs": []
      },
      "conformanceScenarioIds": [
        "baz-009.front.ability.conformance"
      ]
    },
    {
      "abilityId": "baz-010.front.ability",
      "cardId": "baz-010",
      "faceId": "front",
      "exactTextSha256": "039bfb5d8fecc29b6d5a265ef667fb484b37be3f54f9db1c2adbbefcd07e21d1",
      "source": {
        "evidenceId": "base-gallery-2026-10-17",
        "fieldPath": "cards[baz-010].faces[front].exactAbilityText"
      },
      "effectSpec": {
        "status": "deferred",
        "trackingIssue": "#12",
        "reason": "Issue #6 records exact text; executable semantics belong to M1-P10."
      },
      "ambiguityReview": {
        "status": "none-recorded",
        "identifiedAmbiguities": [],
        "ownerDecisionRefs": []
      },
      "conformanceScenarioIds": [
        "baz-010.front.ability.conformance"
      ]
    },
    {
      "abilityId": "baz-011.front.ability",
      "cardId": "baz-011",
      "faceId": "front",
      "exactTextSha256": "d71feacb7a1600488a2c65c175402f390dca5bbcc6734ac8236bb39226962d87",
      "source": {
        "evidenceId": "base-gallery-2026-10-17",
        "fieldPath": "cards[baz-011].faces[front].exactAbilityText"
      },
      "effectSpec": {
        "status": "deferred",
        "trackingIssue": "#12",
        "reason": "Issue #6 records exact text; executable semantics belong to M1-P10."
      },
      "ambiguityReview": {
        "status": "none-recorded",
        "identifiedAmbiguities": [],
        "ownerDecisionRefs": []
      },
      "conformanceScenarioIds": [
        "baz-011.front.ability.conformance"
      ]
    },
    {
      "abilityId": "baz-012.front.ability",
      "cardId": "baz-012",
      "faceId": "front",
      "exactTextSha256": "d94ab04e43c7f396236420ffa18efbb28f72286b6188a1a9c8127a0c794aee6f",
      "source": {
        "evidenceId": "base-gallery-2026-10-17",
        "fieldPath": "cards[baz-012].faces[front].exactAbilityText"
      },
      "effectSpec": {
        "status": "deferred",
        "trackingIssue": "#12",
        "reason": "Issue #6 records exact text; executable semantics belong to M1-P10."
      },
      "ambiguityReview": {
        "status": "none-recorded",
        "identifiedAmbiguities": [],
        "ownerDecisionRefs": []
      },
      "conformanceScenarioIds": [
        "baz-012.front.ability.conformance"
      ]
    },
    {
      "abilityId": "baz-013.front.ability",
      "cardId": "baz-013",
      "faceId": "front",
      "exactTextSha256": "8280caac78190123091aa4d2ea1b11408897e74641f78fddc02196825e649698",
      "source": {
        "evidenceId": "base-gallery-2026-10-17",
        "fieldPath": "cards[baz-013].faces[front].exactAbilityText"
      },
      "effectSpec": {
        "status": "deferred",
        "trackingIssue": "#12",
        "reason": "Issue #6 records exact text; executable semantics belong to M1-P10."
      },
      "ambiguityReview": {
        "status": "none-recorded",
        "identifiedAmbiguities": [],
        "ownerDecisionRefs": []
      },
      "conformanceScenarioIds": [
        "baz-013.front.ability.conformance"
      ]
    },
    {
      "abilityId": "baz-014.front.ability",
      "cardId": "baz-014",
      "faceId": "front",
      "exactTextSha256": "8760befe3978023a7cabb4a09e53780e3d4fa1d5cfc365f759742d892a0e3015",
      "source": {
        "evidenceId": "base-gallery-2026-10-17",
        "fieldPath": "cards[baz-014].faces[front].exactAbilityText"
      },
      "effectSpec": {
        "status": "deferred",
        "trackingIssue": "#12",
        "reason": "Issue #6 records exact text; executable semantics belong to M1-P10."
      },
      "ambiguityReview": {
        "status": "none-recorded",
        "identifiedAmbiguities": [],
        "ownerDecisionRefs": []
      },
      "conformanceScenarioIds": [
        "baz-014.front.ability.conformance"
      ]
    },
    {
      "abilityId": "baz-015.front.ability",
      "cardId": "baz-015",